"#","Nome do Produto","SKU","Categoria","Prioridade","Repostável","Status Post","Link do Produto","Link da Imagem","Legenda Instagram","Observações","Ordem de Postagem"
"2027","Chapéu Masculino Gangster Pralana Social Alpaca Taupe","110112013404","Chapéu","Normal","Não","Não Postado","","","","","1557"
"2028","Chapéu Masculino Grafite Pralana Diamante","110112023583","Chapéu","Normal","Não","Não Postado","","","","","1558"
"2029","Chapéu Masculino Khaki Estonado Pralana Diamante","110112023400","Chapéu","Normal","Não","Não Postado","","","","","1559"
"2031","Chapéu Masculino Marcatto Social Camel","14133-camel","Chapéu","Normal","Não","Não Postado","","","","","1560"
"2032","Chapéu Masculino Marcatto Social Cáqui","14133-cáqui","Chapéu","Normal","Não","Não Postado","","","","","1561"
"2033","Chapéu Masculino Marcatto Social Marrom","14133-marrom","Chapéu","Normal","Não","Não Postado","","","","","1562"
"2034","Chapéu Masculino Marcatto Social Preto","14133-preto","Chapéu","Normal","Não","Não Postado","","","","","1563"
"2035","Chapéu Masculino Marrom Pralana Diamante","110112023810","Chapéu","Normal","Não","Não Postado","","","","","1564"
"2036","Chapéu Masculino Marsin Cairo Amarelo","175126243315","Chapéu","Normal","Não","Não Postado","","","","","1565"
"2037","Chapéu Masculino Pino Pralana Diamante","110112023310","Chapéu","Normal","Não","Não Postado","","","","","1566"
"2040","Chapéu Masculino Pralana Campo 5x Café","110112523274","Chapéu","Normal","Não","Não Postado","","","","","1567"
"2041","Chapéu Masculino Pralana Campo 5x Pino","110112523310 - PINO","Chapéu","Normal","Não","Não Postado","","","","","1568"
"2044","Chapéu Masculino Pralana Classic Indy Castor","110112823672","Chapéu","Normal","Não","Não Postado","","","","","1569"
"2046","Chapéu Masculino Pralana Classic Indy Preto","110112823360","Chapéu","Normal","Não","Não Postado","","","","","1570"
"2047","Chapéu Masculino Pralana Fedora Felt Marrom","110123123274","Chapéu","Normal","Não","Não Postado","","","","","1571"
"2048","Chapéu Masculino Pralana Fedora Felt Preto","110123123360","Chapéu","Normal","Não","Não Postado","","","","","1572"
"2049","Chapéu Masculino Pralana Gangster Social Alpaca Pino - Aba Larga","110112013310","Chapéu","Normal","Não","Não Postado","","","","","1573"
"2050","Chapéu Masculino Pralana Safari III Castor","110112353672","Chapéu","Normal","Não","Não Postado","","","","","1574"
"2053","Chapéu Masculino Pralana Social Gangster Alpaca Cáqui","110112013041","Chapéu","Normal","Não","Não Postado","","","","","1575"
"2052","Chapéu Masculino Pralana Social Gangster Alpaca Castor","110112013672","Chapéu","Normal","Não","Não Postado","","","","","1576"
"2054","Chapéu Masculino Pralana Weekender Aba 7 Castor","110116513672","Chapéu","Normal","Não","Não Postado","","","","","1577"
"2055","Chapéu Masculino Preto Pralana Diamante","110112023360","Chapéu","Normal","Não","Não Postado","","","","","1578"
"2056","Chapéu Masculino Richard Marcatto","15894","Chapéu","Normal","Não","Não Postado","","","","","1579"
"2059","Chapéu Masculino Richard Marcatto-Bege-Tam 60","15894-Bege-Tam 60","Chapéu","Normal","Não","Não Postado","","","","","1580"
"2061","Chapéu Masculino Social Colombo Cáqui","14099-cáqui","Chapéu","Normal","Não","Não Postado","","","","","1581"
"2062","Chapéu Masculino Social Colombo Preto","14099-preto","Chapéu","Normal","Não","Não Postado","","","","","1582"
"2063","Chapéu Masculino Social Colombo Tabaco","14099-tabaco","Chapéu","Normal","Não","Não Postado","","","","","1583"
"2065","Chapéu Masculino Social Premium 2x Preto","7056-preto","Chapéu","Normal","Não","Não Postado","","","","","1584"
"2066","Chapéu Masculino Social Premium 2x Tabaco","7056-tabaco","Chapéu","Normal","Não","Não Postado","","","","","1585"
"2070","Chapéu Masculino Social Premium 2x-Preto-Tam 61","7056-Preto-Tam 61","Chapéu","Normal","Não","Não Postado","","","","","1586"
"2074","Chapéu Masculino Social Premium 2x-Tabaco-Tam 61","7056-Tabaco-Tam 61","Chapéu","Normal","Não","Não Postado","","","","","1587"
"2076","Chapéu Melbourne Bigalli Black","biga15216-N02","Chapéu","Normal","Não","Não Postado","","","","","1588"
"2077","Chapéu Melbourne Bigalli Khaki","biga15216-H10","Chapéu","Normal","Não","Não Postado","","","","","1589"
"2078","Chapéu Melbourne Bigalli Moss","biga15216-V01","Chapéu","Normal","Não","Não Postado","","","","","1590"
"2079","Chapéu Melbourne Bigalli Tabaco","biga15216-tabaco","Chapéu","Normal","Não","Não Postado","","","","","1591"
"2080","Chapéu Melbourne TE Panamá Legítimo Bigalli Natural","biga15070-natural","Chapéu","Normal","Não","Não Postado","","","","","1592"
"2084","Chapéu Meridional de Juta Natural Sibu Company","018.12.03.001","Chapéu","Normal","Não","Não Postado","","","","","1593"
"2081","Chapéu Meridional Fibra Natural Sibu Company","018.12.13.001","Chapéu","Normal","Não","Não Postado","","","","","1594"
"2082","Chapéu Meridional Lona de Algodão Bege Sibu Company","018.12.02.002","Chapéu","Normal","Não","Não Postado","","","","","1595"
"2083","Chapéu Meridional Lona de Algodão Crú Sibu Company","2018.12.02","Chapéu","Normal","Não","Não Postado","","","","","1596"
"2088","Chapéu Miguel 2X Premium-Avelã-Tam 61","7056A-Avelã-Tam 61","Chapéu","Normal","Não","Não Postado","","","","","1597"
"2093","Chapéu Miguel Shantung 10X Soft-Marfim-Tam 54","3077-Marfim-Tam 54","Chapéu","Normal","Não","Não Postado","","","","","1598"
"1906","Chapéu MIlano Fibra Natural Sibu Company","007.04.13.001","Chapéu","Normal","Não","Não Postado","","","","","1599"
"2101","Chapéu Milano Juta Natural Sibu Company","007.04.03.001","Chapéu","Normal","Não","Não Postado","","","","","1600"
"2102","Chapéu Milano Lona de Algodão Bege Sibu Company","007.04.02.002","Chapéu","Normal","Não","Não Postado","","","","","1601"
"2103","Chapéu Milano Lona de Algodão Crú Sibu Company","007.04.02.001","Chapéu","Normal","Não","Não Postado","","","","","1602"
"2104","Chapéu Milano Sibu Company Lã Areia","007.04.04.027","Chapéu","Normal","Não","Não Postado","","","","","1603"
"2105","Chapéu Milano Sibu Company Lã Azul","007.04.04.024","Chapéu","Normal","Não","Não Postado","","","","","1604"
"2106","Chapéu Milano Sibu Company Lã Chumbo","007.04.04.046","Chapéu","Normal","Não","Não Postado","","","","","1605"
"2107","Chapéu Milano Sibu Company Lã Marrom","007.04.04.053","Chapéu","Normal","Não","Não Postado","","","","","1606"
"2108","Chapéu Milano Sibu Company Lã Preto","007.04.04.022","Chapéu","Normal","Não","Não Postado","","","","","1607"
"2109","Chapéu Milano Sibu Company Lã Verde","007.04.04.025","Chapéu","Normal","Não","Não Postado","","","","","1608"
"2110","Chapéu Milano Sibu Company Lã Vermelho","007.04.04.026","Chapéu","Normal","Não","Não Postado","","","","","1609"
"2115","Chapéu Napoli-Azul-Tamanho Único","CH014+5-Azul-Tamanho Único","Chapéu","Normal","Não","Não Postado","","","","","1610"
"2117","Chapéu Odyssey Bigalli Khaky","biga24002-khaky","Chapéu","Normal","Não","Não Postado","","","","","1611"
"2118","Chapéu Open Road Masculino Pralana Castor","open road castor pralana","Chapéu","Normal","Não","Não Postado","","","","","1612"
"2119","Chapéu Outback Adam Preto","14061-preto","Chapéu","Normal","Não","Não Postado","","","","","1613"
"2120","Chapéu Outback Adam Tabaco","14061-tabaco","Chapéu","Normal","Não","Não Postado","","","","","1614"
"2121","Chapéu Outback Algas Marcatto","15917-cor 12-natural","Chapéu","Normal","Não","Não Postado","","","","","1615"
"2122","Chapéu Outback Dundee","110112513400","Chapéu","Normal","Não","Não Postado","","","","","1616"
"2123","Chapéu Outback Marcatto Lisboa Cáqui","15817-cáqui","Chapéu","Normal","Não","Não Postado","","","","","1617"
"2125","Chapéu Outback Marcatto Zeus Marfim","15865-branco","Chapéu","Normal","Não","Não Postado","","","","","1618"
"2126","Chapéu Outback Masculino Jorge Marrom","15895-marrom","Chapéu","Normal","Não","Não Postado","","","","","1619"
"2128","Chapéu Pagodeiro Fedora Aba Curta Marcatto Bege","15880-bege","Chapéu","Normal","Não","Não Postado","","","","","1620"
"2129","Chapéu Pagodeiro Fedora Aba Curta Marcatto Marfim","15880-marfim","Chapéu","Normal","Não","Não Postado","","","","","1621"
"2130","Chapéu Palha Aba Larga Marcatto Casual Fita Bege","15884-bege","Chapéu","Normal","Não","Não Postado","","","","","1622"
"2131","Chapéu Palha Aba Larga Marcatto Lorenzo","15859","Chapéu","Normal","Não","Não Postado","","","","","1623"
"2136","Chapéu Palha Fernanda Caqui- Proteção Solar UV","25124-caqui","Chapéu","Normal","Não","Não Postado","","","","","1624"
"2137","Chapéu Palha Fernanda Marrom - Proteção Solar UV","25119-marrom","Chapéu","Normal","Não","Não Postado","","","","","1625"
"2138","Chapéu Palha Fernanda Preto - Proteção Solar  UV","25124-preto","Chapéu","Normal","Não","Não Postado","","","","","1626"
"2139","Chapéu Palha Fernanda-Areia-Tamanho Único","25119-Areia-Tamanho Único","Chapéu","Normal","Não","Não Postado","","","","","1627"
"2140","Chapéu Palha Fernanda-Branco-Tamanho Único","25119-Branco-Tamanho Único","Chapéu","Normal","Não","Não Postado","","","","","1628"
"2141","Chapéu Palha Fernanda-Cáqui-Tamanho Único","25124-Cáqui-Tamanho Único","Chapéu","Normal","Não","Não Postado","","","","","1629"
"2142","Chapéu Palha Fernanda-Marrom-Tamanho Único","25119-Marrom-Tamanho Único","Chapéu","Normal","Não","Não Postado","","","","","1630"
"973","Chapeu Palha Jimmy-Marfim-Tam 59","25823-Marfim-Tam 59","Chapéu","Normal","Não","Não Postado","","","","","1631"
"2146","Chapéu Palha Lola-Azul Marinho-Tam 60","15877-Azul Marinho-Tam 60","Chapéu","Normal","Não","Não Postado","","","","","1632"
"2148","Chapéu Palha Marcatto Fita Listrada","15884-listrada","Chapéu","Normal","Não","Não Postado","","","","","1633"
"2149","Chapéu Palha Panamá Clássico Marcatto Marfim Fita Bege","11079-branco","Chapéu","Normal","Não","Não Postado","","","","","1634"
"2150","Chapéu Palha Panamá Clássico Marcatto Marrom","11079-marrom","Chapéu","Normal","Não","Não Postado","","","","","1635"
"2151","Chapéu Palha Panamá Marcatto Marfim Aba Larga Benito","11067-marfim","Chapéu","Normal","Não","Não Postado","","","","","1636"
"2161","Chapéu Palha Tira de Couro","15876","Chapéu","Normal","Não","Não Postado","","","","","1637"
"2163","Chapéu Palha Ventilado Aba Larga Nevada","15929","Chapéu","Normal","Não","Não Postado","","","","","1638"
"2164","Chapéu Palha Victória","170138303642","Chapéu","Normal","Não","Não Postado","","","","","1639"
"2165","Chapéu Palheta Boater Pralana Unissex","196155413671","Chapéu","Normal","Não","Não Postado","","","","","1640"
"2166","Chapéu Palheta Manly Dourado","29767-amarelo","Chapéu","Normal","Não","Não Postado","","","","","1641"
"2167","Chapéu Palheta Manly Shantung Casual Fita Azul + 2 fitas nas cores preta e colorida","25266-cor097","Chapéu","Normal","Não","Não Postado","","","","","1642"
"2168","Chapéu Palheta Manly Shantung Casual Fita Preta + 2 fitas nas cores laranja e azul","25266-classic096","Chapéu","Normal","Não","Não Postado","","","","","1643"
"2169","Chapéu Palheta Manly Shantung Casual Fita Preta + 2 fitas nas cores verde e rosa","25266-096","Chapéu","Normal","Não","Não Postado","","","","","1644"
"2170","Chapéu Palheta Toyo Creme","1099-creme","Chapéu","Normal","Não","Não Postado","","","","","1645"
"2173","Chapéu Palheta Toyo-Creme-Tam 58","1099-Creme-Tam 58","Chapéu","Normal","Não","Não Postado","","","","","1646"
"2175","Chapéu Panamá Aba Curta Preto","11063-preto","Chapéu","Normal","Não","Não Postado","","","","","1647"
"2176","Chapéu Panamá Aba Média Legítimo","11080","Chapéu","Normal","Não","Não Postado","","","","","1648"
"2177","Chapéu Panamá Antony Caqui","11074-caqui","Chapéu","Normal","Não","Não Postado","","","","","1649"
"2178","Chapéu Panamá Cavalgada Marcatto Bege","11085-COR 12 Natural","Chapéu","Normal","Não","Não Postado","","","","","1650"
"2180","Chapéu Panamá Fedora Miguel -Branco-Tam 57","4341-Branco-Tam 57","Chapéu","Normal","Não","Não Postado","","","","","1651"
"2181","Chapéu Panamá Fedora Miguel Branco","4341","Chapéu","Normal","Não","Não Postado","","","","","1652"
"2183","Chapéu Panamá Fedora Miguel Branco-Branco-Tam 61","4341-Branco-Tam 61","Chapéu","Normal","Não","Não Postado","","","","","1653"
"2189","Chapéu Panamá Feminino Alice Bege","21090","Chapéu","Normal","Não","Não Postado","","","","","1654"
"2190","Chapéu Panamá Feminino Palheta Manly Copa Reta Branco","21190-branco","Chapéu","Normal","Não","Não Postado","","","","","1655"
"2191","Chapéu Panamá Feminino Palheta Manly Copa Reta Marrom","21196-marrom","Chapéu","Normal","Não","Não Postado","","","","","1656"
"2192","Chapéu Panamá Feminino Paris Manly Branco","21196-branco","Chapéu","Normal","Não","Não Postado","","","","","1657"
"2194","Chapéu Panamá Heitor","21053","Chapéu","Normal","Não","Não Postado","","","","","1658"
"2195","Chapéu Panamá Jude Mostarda","170138383748","Chapéu","Normal","Não","Não Postado","","","","","1659"
"2196","Chapéu Panamá Marcatto Aba Curta Bege","11063-bege","Chapéu","Normal","Não","Não Postado","","","","","1660"
"2197","Chapéu Panamá Marcatto Aba Curta Marfim","11063-marfim","Chapéu","Normal","Não","Não Postado","","","","","1661"
"2199","Chapéu Panamá Marcatto Bege Aba Larga Benito","11067-fita bege","Chapéu","Normal","Não","Não Postado","","","","","1662"
"2200","Chapéu Panamá Marcatto Casual Piqué","11072","Chapéu","Normal","Não","Não Postado","","","","","1663"
"2203","Chapéu Panamá Original Aba Média Romeu","11064","Chapéu","Normal","Não","Não Postado","","","","","1664"
"2204","Chapéu Panamá Original Aba Média Romeu Bege","11064-bege","Chapéu","Normal","Não","Não Postado","","","","","1665"
"2205","Chapéu Panamá Original Bege Leblon","21106","Chapéu","Normal","Não","Não Postado","","","","","1666"
"2207","Chapéu Panamá Original Marcatto Casual Marfim","11075-fita bege","Chapéu","Normal","Não","Não Postado","","","","","1667"
"2208","Chapéu Panamá Original Marcatto Marfim","11075-fita preta","Chapéu","Normal","Não","Não Postado","","","","","1668"
"2209","Chapéu Panamá Original Montecristi Toquilla Aba Larga Marfim","2114","Chapéu","Normal","Não","Não Postado","","","","","1669"
"2210","Chapéu Panamá Original Montecristi Toquilla Azul","2111-azul","Chapéu","Normal","Não","Não Postado","","","","","1670"
"2212","Chapéu Panamá Original Montecristi Toquilla Bege","2116","Chapéu","Normal","Não","Não Postado","","","","","1671"
"2214","Chapéu Panamá Original Montecristi Toquilla Goiaba","2111-Goiaba","Chapéu","Normal","Não","Não Postado","","","","","1672"
"2216","Chapéu Panamá Original Montecristi Toquilla Marrom","2112","Chapéu","Normal","Não","Não Postado","","","","","1673"
"2218","Chapéu Panamá Original Montecristi Toquilla Verde","2111-verde","Chapéu","Normal","Não","Não Postado","","","","","1674"
"2222","Chapéu Panamá Paris Feminino Palheta Manly Copa Reta Bege","21196-caqui","Chapéu","Normal","Não","Não Postado","","","","","1675"
"2225","Chapéu Panamá Pralana Aba Curta Galante","170136303671","Chapéu","Normal","Não","Não Postado","","","","","1676"
"2226","Chapéu Panamá Pralana Aba Curta Galante Branco","170136303315","Chapéu","Normal","Não","Não Postado","","","","","1677"
"2227","Chapéu Panamá Pralana Jobim Bege","170132663671","Chapéu","Normal","Não","Não Postado","","","","","1678"
"2228","Chapéu Panamá Pralana Jobim Marfim","170132663315","Chapéu","Normal","Não","Não Postado","","","","","1679"
"975","Chapeu Panamá Pralana Weekender II Bege","170132043671","Chapéu","Normal","Não","Não Postado","","","","","1680"
"2229","Chapéu Panamá Preto Original Montecristi Toquilla","2111-preto","Chapéu","Normal","Não","Não Postado","","","","","1681"
"2230","Chapéu Panamá Raquel Champagne","21067-champagne","Chapéu","Normal","Não","Não Postado","","","","","1682"
"2231","Chapéu Panamá Raquel-Champanhe-Tamanho Único","21067-Champanhe-Tamanho Único","Chapéu","Normal","Não","Não Postado","","","","","1683"
"2232","Chapéu Panamá Raquel-Preto-Tamanho Único","21067-Preto-Tamanho Único","Chapéu","Normal","Não","Não Postado","","","","","1684"
"2233","Chapéu Panamá Ruth - Proteção Solar UV","21063","Chapéu","Normal","Não","Não Postado","","","","","1685"
"2234","Chapéu Panamá Ruth-Champanhe-Tamanho Único","21063-Champanhe-Tamanho Único","Chapéu","Normal","Não","Não Postado","","","","","1686"
"2236","Chapéu Panamá Summer Marinho","21072-marinho","Chapéu","Normal","Não","Não Postado","","","","","1687"
"2241","Chapéu Panamá Summer-Azul Marinho-Tam 60","21072-Azul Marinho-Tam 60","Chapéu","Normal","Não","Não Postado","","","","","1688"
"2245","Chapéu Panamá Summer-Azul-Tam 60","21072-Azul-Tam 60","Chapéu","Normal","Não","Não Postado","","","","","1689"
"2249","Chapéu Panamá Summer-Marfim-Tam 60","21072-Marfim-Tam 60","Chapéu","Normal","Não","Não Postado","","","","","1690"
"2250","Chapéu Panamá Weekender Soft","170132323315","Chapéu","Normal","Não","Não Postado","","","","","1691"
"2251","Chapéu Pantanal 5x Marsin Pralana","110123693274","Chapéu","Normal","Não","Não Postado","","","","","1692"
"2252","Chapéu Pantaneiro Fibra Natural Sibu Company","022.11.13.001","Chapéu","Normal","Não","Não Postado","","","","","1693"
"2253","Chapéu Pantaneiro Juta Natural Sibu Company","022.11.03.001","Chapéu","Normal","Não","Não Postado","","","","","1694"
"2254","Chapéu Pantaneiro Lona de Algodão Bege Sibu Company","022.11.02.002","Chapéu","Normal","Não","Não Postado","","","","","1695"
"2255","Chapéu Pantaneiro Lona de Algodão Crú Sibu Company","022.11.02.001","Chapéu","Normal","Não","Não Postado","","","","","1696"
"2496","Chapéu Pêlo de Lebre Marsin Pralana Taupe - Edição Especial","165169033679","Chapéu","Normal","Não","Não Postado","","","","","1697"
"2497","Chapéu Pêlo de Lebre Pralana Preto","165169013360","Chapéu","Normal","Não","Não Postado","","","","","1698"
"2498","Chapéu Pêlo de Lebre Pralana Taupe","165169013679-Taupe","Chapéu","Normal","Não","Não Postado","","","","","1699"
"2259","Chapéu Pierina de Juta Natural Sibu Company","011.05.03.001","Chapéu","Normal","Não","Não Postado","","","","","1700"
"2257","Chapéu Pierina Fibra Natural Sibu Company","011.05.13.001","Chapéu","Normal","Não","Não Postado","","","","","1701"
"2258","Chapéu Pierina Lona de Algodão Crú Sibu Company","011.05.02.001","Chapéu","Normal","Não","Não Postado","","","","","1702"
"2261","Chapéu Pork Pie Aba Curta Preto","1601179933601","Chapéu","Normal","Não","Não Postado","","","","","1703"
"2262","Chapéu Pork Pie Fibra Natural Sibu Company","091.12.13.001","Chapéu","Normal","Não","Não Postado","","","","","1704"
"2263","Chapéu Pork Pie Jason Sibu Company Areia","094.14.04.027","Chapéu","Normal","Não","Não Postado","","","","","1705"
"2264","Chapéu Pork Pie Jason Sibu Company Azul","094.14.04.024","Chapéu","Normal","Não","Não Postado","","","","","1706"
"2266","Chapéu Pork Pie Jason Sibu Company Chumbo","094.14.04.046","Chapéu","Normal","Não","Não Postado","","","","","1707"
"2267","Chapéu Pork Pie Jason Sibu Company Marrom","094.14.04.053","Chapéu","Normal","Não","Não Postado","","","","","1708"
"2268","Chapéu Pork Pie Jason Sibu Company Preto","094.14.04.022","Chapéu","Normal","Não","Não Postado","","","","","1709"
"2270","Chapéu Pork Pie Jason Sibu Company Verde","094.14.04.025","Chapéu","Normal","Não","Não Postado","","","","","1710"
"2271","Chapéu Pork Pie Jason Sibu Company Vermelho","094.14.04.026","Chapéu","Normal","Não","Não Postado","","","","","1711"
"2272","Chapéu Pork Pie Juta Natural Sibu Company","091.12.03.001","Chapéu","Normal","Não","Não Postado","","","","","1712"
"2275","Chapéu Pork Pie Lona de Algodão Bege Sibu Company","091.12.02.002","Chapéu","Normal","Não","Não Postado","","","","","1713"
"2277","Chapéu Pork Pie Pralana Cinza Escuro Heisenberg Aba Curta","160117993387","Chapéu","Normal","Não","Não Postado","","","","","1714"
"2278","Chapéu Pork Pie Pralana Marrom Café Heisenberg Aba Curta","160117993274","Chapéu","Normal","Não","Não Postado","","","","","1715"
"2279","Chapéu Pork Pie Pralana Preto Aba Média","110123303360","Chapéu","Normal","Não","Não Postado","","","","","1716"
"2280","Chapéu Pork Pie Pralana Preto Heisenberg Aba Curta","160117993360","Chapéu","Normal","Não","Não Postado","","","","","1717"
"2281","Chapéu Pork Pie Premium  Pêlo de Lebre Preto","094.14.00.43","Chapéu","Normal","Não","Não Postado","","","","","1718"
"2282","Chapéu Pork Pie Premium II Pêlo de Lebre Preto","094.14.00.41","Chapéu","Normal","Não","Não Postado","","","","","1719"
"2283","Chapéu Pork Pie Stingy Bigalli Black","biga14060-N02","Chapéu","Normal","Não","Não Postado","","","","","1720"
"2284","Chapéu Pork Pie Stingy Bigalli Chocolate","biga14060-C03","Chapéu","Normal","Não","Não Postado","","","","","1721"
"2285","Chapéu Pork Pie Stingy Bigalli Dark Gray","biga14060-G03","Chapéu","Normal","Não","Não Postado","","","","","1722"
"2286","Chapéu Pork Pie Trilby Panamá Legítimo Bigalli Black","biga17018-N02","Chapéu","Normal","Não","Não Postado","","","","","1723"
"2287","Chapéu Pork Pie Trilby Panamá Legítimo Bigalli Natural","biga17018-NAT","Chapéu","Normal","Não","Não Postado","","","","","1724"
"2288","Chapéu Pork Pie Trilby Panamá Legítimo Bigalli Putty","biga17018-C35","Chapéu","Normal","Não","Não Postado","","","","","1725"
"2289","Chapéu Pork Pie Trilby Panamá Legítimo Bigalli White","biga17018-B02","Chapéu","Normal","Não","Não Postado","","","","","1726"
"2290","Chapéu Pork Pie Williams Feltro Areia Sibu Company","091.12.17.027","Chapéu","Normal","Não","Não Postado","","","","","1727"
"2291","Chapéu Pork Pie Williams Feltro Preto Sibu Company","091.12.17.022","Chapéu","Normal","Não","Não Postado","","","","","1728"
"2298","Chapéu Praia Copa Redonda Feminino Manly","25222","Chapéu","Normal","Não","Não Postado","","","","","1729"
"2299","Chapéu Praia Fedora Miguel Soft Marfim","3077","Chapéu","Normal","Não","Não Postado","","","","","1730"
"2300","Chapéu Praia Feminino Bucket Manly Preto","25280-preto","Chapéu","Normal","Não","Não Postado","","","","","1731"
"2301","Chapéu Praia Feminino Bucket Manly Verde Cáqui","25280-verde cáqui","Chapéu","Normal","Não","Não Postado","","","","","1732"
"2302","Chapéu Praia Feminino Floppy Azul Marinho Verão","29737-marinho","Chapéu","Normal","Não","Não Postado","","","","","1733"
"2303","Chapéu Praia Feminino Floppy Bege Verão","29737-bege","Chapéu","Normal","Não","Não Postado","","","","","1734"
"2305","Chapéu Praia Feminino Floppy Caramelo Verão","29737-caramelo","Chapéu","Normal","Não","Não Postado","","","","","1735"
"2308","Chapéu Praia Feminino Floppy Preto Verão","29737-preto","Chapéu","Normal","Não","Não Postado","","","","","1736"
"2310","Chapéu Praia Feminino Palheta Manly Areia","25263-areia","Chapéu","Normal","Não","Não Postado","","","","","1737"
"2311","Chapéu Praia Feminino Palheta Manly Azul Marinho","25263-azul marinho","Chapéu","Normal","Não","Não Postado","","","","","1738"
"2312","Chapéu Praia Feminino Palheta Manly Cáqui","25263-cáqui","Chapéu","Normal","Não","Não Postado","","","","","1739"
"2313","Chapéu Praia Feminino Palheta Manly Preto","25263-preto","Chapéu","Normal","Não","Não Postado","","","","","1740"
"2315","Chapéu Praia Feminino Proteção Solar Areia","25163-areia-U","Chapéu","Normal","Não","Não Postado","","","","","1741"
"2316","Chapéu Praia Feminino Proteção Solar Manly Azul Marinho","25185-marinho","Chapéu","Normal","Não","Não Postado","","","","","1742"
"2317","Chapéu Praia Feminino Proteção Solar Manly Preto","25185-preto","Chapéu","Normal","Não","Não Postado","","","","","1743"
"2318","Chapéu Praia Feminino Proteção Solar UV San Remo Areia","501001186601","Chapéu","Normal","Não","Não Postado","","","","","1744"
"2319","Chapéu Praia Feminino Proteção Solar UV San Remo Azul Marinho","5010011582","Chapéu","Normal","Não","Não Postado","","","","","1745"
"2320","Chapéu Praia Feminino Proteção Solar UV San Remo Cinza","5010011030","Chapéu","Normal","Não","Não Postado","","","","","1746"
"2322","Chapéu Praia Feminino Proteção Solar UV San Remo kaki","501001171401","Chapéu","Normal","Não","Não Postado","","","","","1747"
"2321","Chapéu Praia Feminino Proteção Solar UV San Remo Preto","5010011002","Chapéu","Normal","Não","Não Postado","","","","","1748"
"2323","Chapéu Praia Feminino Proteção UV Cáqui Manly","25185-cáqui","Chapéu","Normal","Não","Não Postado","","","","","1749"
"2324","Chapéu Praia Feminino Proteção UV Fernanda Areia","25161-Areia","Chapéu","Normal","Não","Não Postado","","","","","1750"
"2325","Chapéu Praia Feminino Proteção UV Fernanda Caqui","25161-caqui","Chapéu","Normal","Não","Não Postado","","","","","1751"
"2326","Chapéu Praia Feminino Proteção UV Fernanda Marrom","25161-marrom","Chapéu","Normal","Não","Não Postado","","","","","1752"
"2327","Chapéu Praia Feminino Proteção UV Fernanda Preto","25161-preto","Chapéu","Normal","Não","Não Postado","","","","","1753"
