"#","Nome do Produto","SKU","Categoria","Prioridade","Repostável","Status Post","Link do Produto","Link da Imagem","Legenda Instagram","Observações","Ordem de Postagem"
"646","Boina Masculina Xadrez Pied de Poule Bege","700006142","Boina","Normal","Não","Não Postado","","","","","569"
"647","Boina Masculina Xadrez Pied de Poule Cinza","700006120","Boina","Normal","Não","Não Postado","","","","","570"
"648","Boina Masculina Xadrez Príncipe de Gales","700006148","Boina","Normal","Não","Não Postado","","","","","571"
"649","Boina Mike Vermelha","LV214-vermelha","Boina","Normal","Não","Não Postado","","","","","572"
"653","Boina Militar de Feltro Azul Celeste San Doná","082.61.16.923","Boina","Normal","Não","Não Postado","","","","","573"
"654","Boina Militar de Feltro Azul Marinho San Doná","082.61.16.924","Boina","Normal","Não","Não Postado","","","","","574"
"655","Boina Militar de Feltro Azul ONU San Doná","082.61.16.990","Boina","Normal","Não","Não Postado","","","","","575"
"656","Boina Militar de Feltro Azul Royal San Doná","082.61.16.928","Boina","Normal","Não","Não Postado","","","","","576"
"659","Boina Militar de Feltro Cáqui San Doná","082.61.16.927","Boina","Normal","Não","Não Postado","","","","","577"
"657","Boina Militar de Feltro Cinza Bandeira San Doná","082.61.16.986","Boina","Normal","Não","Não Postado","","","","","578"
"658","Boina Militar de Feltro Cinza San Doná","082.61.16.954","Boina","Normal","Não","Não Postado","","","","","579"
"660","Boina Militar de Feltro Grafite San Doná","082.61.16.946","Boina","Normal","Não","Não Postado","","","","","580"
"661","Boina Militar de Feltro Grená San Doná","082.61.16.945","Boina","Normal","Não","Não Postado","","","","","581"
"662","Boina Militar de Feltro Preto San Doná","082.61.16.922","Boina","Normal","Não","Não Postado","","","","","582"
"664","Boina Militar de Feltro Vermelho Bombeiro San Doná","082.61.16.921","Boina","Normal","Não","Não Postado","","","","","583"
"665","Boina Militar de Feltro Vermelho Cardeal San Doná","082.61.16.926","Boina","Normal","Não","Não Postado","","","","","584"
"651","Boina Militar Verde Pralana","130114063362","Boina","Normal","Não","Não Postado","","","","","585"
"652","Boina Militar Vermelha Pralana","130114063112","Boina","Normal","Não","Não Postado","","","","","586"
"666","Boina Paraná Militar Camuflada San Doná","086.00.06.039","Boina","Normal","Não","Não Postado","","","","","587"
"667","Boina Paraná Militar Cáqui San Doná","086.00.06.057","Boina","Normal","Não","Não Postado","","","","","588"
"668","Boina Paraná Militar Marrom San Doná","086.00.06.053","Boina","Normal","Não","Não Postado","","","","","589"
"669","Boina Paraná San Doná Militar Helanca Azul","086.00.12.024","Boina","Normal","Não","Não Postado","","","","","590"
"670","Boina Paraná San Doná Militar Helanca Preta","086.00.12.022","Boina","Normal","Não","Não Postado","","","","","591"
"671","Boina Paraná San Doná Militar Helanca Verde Militar","086.00.12.025","Boina","Normal","Não","Não Postado","","","","","592"
"672","Boina Pralana Borguetti II Branca","170196653270","Boina","Normal","Não","Não Postado","","","","","593"
"680","Boina Santiago Azul - Proteção Solar","201001303106","Boina","Normal","Não","Não Postado","","","","","594"
"683","Boina Santiago-Azul Marinho-Tamanho Único","BN078-Azul Marinho","Boina","Normal","Não","Não Postado","","","","","595"
"684","Boina Santiago-Azul-Tamanho Único","0201001303106-Azul-U","Boina","Normal","Não","Não Postado","","","","","596"
"685","Boina Santiago-Cinza-Tamanho Único","BN078-Cinza-Cinza-Único","Boina","Normal","Não","Não Postado","","","","","597"
"686","Boina Santiago-Preto-Tamanho Único","BN078-Preto-Único","Boina","Normal","Não","Não Postado","","","","","598"
"687","Boina Scala Mike Preta","LV214","Boina","Normal","Não","Não Postado","","","","","599"
"688","Boina Scala Tiffany -Marrom-Tamanho Único","LW391-Marrom-U-Marrom-Único","Boina","Normal","Não","Não Postado","","","","","600"
"689","Boina Scala Tiffany -Preto-Tamanho Único","LW391-Preta-U-Preto-Único","Boina","Normal","Não","Não Postado","","","","","601"
"690","Boina Scala Tiffany Marrom","LW391-Marrom-U","Boina","Normal","Não","Não Postado","","","","","602"
"691","Boina Scala Tiffany Preta","LW391-Preta-U","Boina","Normal","Não","Não Postado","","","","","603"
"692","Boina Tapa Orelha Areia","19406-bege","Boina","Normal","Não","Não Postado","","","","","604"
"693","Boina Tapa Orelha Cinza Inverno","790006031","Boina","Normal","Não","Não Postado","","","","","605"
"696","Boina Tradicional com Orelha Marrom","19406-marrom","Boina","Normal","Não","Não Postado","","","","","606"
"695","Boina Tradicional Feltro Masculina Preta","Boné Tradicional Soft - COR 22","Boina","Normal","Não","Não Postado","","","","","607"
"697","Boina Unissex Oito Gomos Azul Atlântico","077.00.06.828","Boina","Normal","Não","Não Postado","","","","","608"
"698","Boina Unissex Oito Gomos Azul Marinho","077.00.06.824","Boina","Normal","Não","Não Postado","","","","","609"
"699","Boina Unissex Oito Gomos Azul Marinho Poá Colorido","077.00.06.153","Boina","Normal","Não","Não Postado","","","","","610"
"700","Boina Unissex Oito Gomos Azul Pretóleo","077.00.06.172","Boina","Normal","Não","Não Postado","","","","","611"
"701","Boina Unissex Oito Gomos Bege e Cáqui","077.00.06.142","Boina","Normal","Não","Não Postado","","","","","612"
"702","Boina Unissex Oito Gomos Bordô","077.00.06.845","Boina","Normal","Não","Não Postado","","","","","613"
"703","Boina Unissex Oito Gomos Branca","077.00.06.023","Boina","Normal","Não","Não Postado","","","","","614"
"704","Boina Unissex Oito Gomos Cáqui","077.00.06.827","Boina","Normal","Não","Não Postado","","","","","615"
"729","Boina Unissex Oito Gomos com Lapela Azul Marinho","133.00.06.024","Boina","Normal","Não","Não Postado","","","","","616"
"730","Boina Unissex Oito Gomos com Lapela Azul Petróleo","133.00.06.172","Boina","Normal","Não","Não Postado","","","","","617"
"731","Boina Unissex Oito Gomos com Lapela Bege e Cáqui","133.00.06.142","Boina","Normal","Não","Não Postado","","","","","618"
"732","Boina Unissex Oito Gomos com Lapela Branco","133.00.06.023","Boina","Normal","Não","Não Postado","","","","","619"
"734","Boina Unissex Oito Gomos com Lapela Cáqui","133.00.06.057","Boina","Normal","Não","Não Postado","","","","","620"
"733","Boina Unissex Oito Gomos com Lapela Cinza Escuro","133.00.06.054","Boina","Normal","Não","Não Postado","","","","","621"
"735","Boina Unissex Oito Gomos com Lapela Marfim","133.00.06.027","Boina","Normal","Não","Não Postado","","","","","622"
"736","Boina Unissex Oito Gomos com Lapela Marrom","133.00.06.053","Boina","Normal","Não","Não Postado","","","","","623"
"737","Boina Unissex Oito Gomos com Lapela Preto Leve","133.00.06.022","Boina","Normal","Não","Não Postado","","","","","624"
"738","Boina Unissex Oito Gomos com Lapela Quadriculado Ferrugem","133.00.06.180","Boina","Normal","Não","Não Postado","","","","","625"
"739","Boina Unissex Oito Gomos com Lapela Veludo Cinza","133.00.06.746","Boina","Normal","Não","Não Postado","","","","","626"
"740","Boina Unissex Oito Gomos com Lapela Veludo Preto","133.00.06.722","Boina","Normal","Não","Não Postado","","","","","627"
"741","Boina Unissex Oito Gomos com Lapela Veludo Verde","133.00.06.725","Boina","Normal","Não","Não Postado","","","","","628"
"742","Boina Unissex Oito Gomos com Lapela Verde Militar","133.00.06.091","Boina","Normal","Não","Não Postado","","","","","629"
"743","Boina Unissex Oito Gomos com Lapela Vermelha","133.00.06.026","Boina","Normal","Não","Não Postado","","","","","630"
"744","Boina Unissex Oito Gomos com Lapela Xadrez Branco e Preto","133.00.06.185","Boina","Normal","Não","Não Postado","","","","","631"
"747","Boina Unissex Oito Gomos com Lapela Xadrez Cáqui e Bege","133.00.06.092","Boina","Normal","Não","Não Postado","","","","","632"
"745","Boina Unissex Oito Gomos com Lapela Xadrez Cinza, Branco e Azul","133.00.06.109","Boina","Normal","Não","Não Postado","","","","","633"
"746","Boina Unissex Oito Gomos com Lapela Xadrez Cinza, Lilás, Preto e Branco","133.00.06.146","Boina","Normal","Não","Não Postado","","","","","634"
"748","Boina Unissex Oito Gomos com Lapela Xadrez Marrom, Bege e Laranja","133.00.06.147","Boina","Normal","Não","Não Postado","","","","","635"
"749","Boina Unissex Oito Gomos com Lapela Xadrez Marrom, Bege, Amarelo e Vermelho","133.00.06.113","Boina","Normal","Não","Não Postado","","","","","636"
"750","Boina Unissex Oito Gomos com Lapela Xadrez Preto e Bege","133.00.06.120","Boina","Normal","Não","Não Postado","","","","","637"
"751","Boina Unissex Oito Gomos com Lapela Xadrez Preto, Bege e Grafite","133.00.06.144","Boina","Normal","Não","Não Postado","","","","","638"
"752","Boina Unissex Oito Gomos com Lapela Xadrez Rosa, Marfim e Bege","133.00.06.145","Boina","Normal","Não","Não Postado","","","","","639"
"753","Boina Unissex Oito Gomos com Lapela Xadrez Tartan Chumbo","133.00.06.749","Boina","Normal","Não","Não Postado","","","","","640"
"754","Boina Unissex Oito Gomos com Lapela Xadrez Verde Militar, Bege e Preto","133.00.06.170","Boina","Normal","Não","Não Postado","","","","","641"
"705","Boina Unissex Oito Gomos Listrada Bege","077.00.06.099","Boina","Normal","Não","Não Postado","","","","","642"
"706","Boina Unissex Oito Gomos Marrom Leve","077.00.06.053","Boina","Normal","Não","Não Postado","","","","","643"
"707","Boina Unissex Oito Gomos Preto Aveludado","077.00.06.822","Boina","Normal","Não","Não Postado","","","","","644"
"708","Boina Unissex Oito Gomos Preto Leve","077.00.06.022","Boina","Normal","Não","Não Postado","","","","","645"
"709","Boina Unissex Oito Gomos Quadriculado Ferrugem","077.00.06.180","Boina","Normal","Não","Não Postado","","","","","646"
"710","Boina Unissex Oito Gomos Rosa Leve","077.00.06.040","Boina","Normal","Não","Não Postado","","","","","647"
"711","Boina Unissex Oito Gomos Veludo Bordô","077.00.06.745","Boina","Normal","Não","Não Postado","","","","","648"
"712","Boina Unissex Oito Gomos Veludo Cinza","077.00.06.746","Boina","Normal","Não","Não Postado","","","","","649"
"713","Boina Unissex Oito Gomos Veludo Marrom","077.00.06.747","Boina","Normal","Não","Não Postado","","","","","650"
"714","Boina Unissex Oito Gomos Veludo Preto","077.00.06.722","Boina","Normal","Não","Não Postado","","","","","651"
"715","Boina Unissex Oito Gomos Veludo Verde","077.00.06.725","Boina","Normal","Não","Não Postado","","","","","652"
"716","Boina Unissex Oito Gomos Verde","077.00.06.825","Boina","Normal","Não","Não Postado","","","","","653"
"717","Boina Unissex Oito Gomos Verde Militar Leve","077.00.06.091","Boina","Normal","Não","Não Postado","","","","","654"
"718","Boina Unissex Oito Gomos Vermelho Leve","077.00.06.026","Boina","Normal","Não","Não Postado","","","","","655"
"719","Boina Unissex Oito Gomos Vinho Poá Colorido","077.00.06.155","Boina","Normal","Não","Não Postado","","","","","656"
"722","Boina Unissex Oito Gomos Xadrez Cáqui e Bege","077.00.06.092","Boina","Normal","Não","Não Postado","","","","","657"
"720","Boina Unissex Oito Gomos Xadrez Chumbo","077.00.06.749","Boina","Normal","Não","Não Postado","","","","","658"
"721","Boina Unissex Oito Gomos Xadrez Cinza, Lilás, Preto e Branco","077.00.06.146","Boina","Normal","Não","Não Postado","","","","","659"
"723","Boina Unissex Oito Gomos Xadrez Marrom, Bege, Amarelo e Vermelho","077.00.06.113","Boina","Normal","Não","Não Postado","","","","","660"
"724","Boina Unissex Oito Gomos Xadrez Preto e Branco","077.00.06.185","Boina","Normal","Não","Não Postado","","","","","661"
"725","Boina Unissex Oito Gomos Xadrez Preto, Bege e Grafite","077.00.06.144","Boina","Normal","Não","Não Postado","","","","","662"
"726","Boina Unissex Oito Gomos Xadrez Preto, Bege, Marrom e Verde","077.00.06.120","Boina","Normal","Não","Não Postado","","","","","663"
"727","Boina Unissex Oito Gomos Xadrez Rosa e Marfim","077.00.06.145","Boina","Normal","Não","Não Postado","","","","","664"
"728","Boina Unissex Oito Gomos Xadrez Verde Militar, Bege e Preto","077.00.06.170","Boina","Normal","Não","Não Postado","","","","","665"
"755","Boina Zeppelin","zeppelin","Boina","Normal","Não","Não Postado","","","","","666"
"767","Boné Aba Curva Dad Hat Boom Cinza","1704479","Boné","Normal","Não","Não Postado","","","","","667"
"768","Boné Aba Curva Dad Hat Chev Vinho","1704481","Boné","Normal","Não","Não Postado","","","","","668"
"769","Boné Aba Curva OC Dad Hat Absolute","1702472","Boné","Normal","Não","Não Postado","","","","","669"
"770","Boné Aba Curva OC Pegasus","1607404","Boné","Normal","Não","Não Postado","","","","","670"
"771","Boné Aba Curva Polo Tedy Vermelho","1605389","Boné","Normal","Não","Não Postado","","","","","671"
"772","Boné Aba Curva Snapback NYC Marinho","1504284","Boné","Normal","Não","Não Postado","","","","","672"
"773","Boné Aba Reta Camurça OC Dunke","1603356","Boné","Normal","Não","Não Postado","","","","","673"
"774","Boné Aba Reta Chicago Run Vermelho","1701462","Boné","Normal","Não","Não Postado","","","","","674"
"775","Boné Aba Reta New York Run Preto","1701461","Boné","Normal","Não","Não Postado","","","","","675"
"776","Boné Aba Reta Snapback OC Brooklyn","1701460","Boné","Normal","Não","Não Postado","","","","","676"
"777","Boné Aba Reta Snapback OC Golden Pray Preto","1608421","Boné","Normal","Não","Não Postado","","","","","677"
"778","Boné Aba Reta Snapback OC Los Angeles","1701463","Boné","Normal","Não","Não Postado","","","","","678"
"779","Boné Aba Reta Snapback OC Originals","1602349","Boné","Normal","Não","Não Postado","","","","","679"
"780","Boné Aba Reta Snapback OC T-Rex","1607411","Boné","Normal","Não","Não Postado","","","","","680"
"783","Boné Baby Herois-Azul-Tamanho de 0 a 2 anos","BN064+138-Azul-0 a 2 anos","Boné","Normal","Não","Não Postado","","","","","681"
"784","Boné Baby Herois-Branco-Tamanho de 0 a 2 anos","BN064-Branco-0 a 2 anos","Boné","Normal","Não","Não Postado","","","","","682"
"785","Boné Baby Herois-Rosa-Tamanho de 0 a 2 anos","BN064+16-Rosa","Boné","Normal","Não","Não Postado","","","","","683"
"786","Boné Basic Cinza","1560-cinza","Boné","Normal","Não","Não Postado","","","","","684"
"787","Boné Basic Preto","1560-preto","Boné","Normal","Não","Não Postado","","","","","685"
"789","Boné Brasil-Amarelo-Tamanho Único","BN079+3-Amarelo-Tamanho Único","Boné","Normal","Não","Não Postado","","","","","686"
"790","Boné Brasil-Azul Royal-Tamanho Único","BN079+5-Azul Royal-Único","Boné","Normal","Não","Não Postado","","","","","687"
"791","Boné Brasil-Verde-Tamanho Único","BN079+15-Verde-Tamanho Único","Boné","Normal","Não","Não Postado","","","","","688"
"792","Boné Feminino Aba Curva Dad Hat Hortus","1701468","Boné","Normal","Não","Não Postado","","","","","689"
"795","Boné Infantil Aba Reta OC Nyc Red","1612452","Boné","Normal","Não","Não Postado","","","","","690"
"796","Boné Infantil Aba Reta OC Paramount","1612454","Boné","Normal","Não","Não Postado","","","","","691"
"797","Boné Infantil Aba Reta OC Pray Vinho","1612455","Boné","Normal","Não","Não Postado","","","","","692"
"798","Boné Infantil Baby Proteção Solar UV Azul Marinho","201001201901","Boné","Normal","Não","Não Postado","","","","","693"
"799","Boné Infantil Baby Proteção Solar UV Verde Água","201001819001","Boné","Normal","Não","Não Postado","","","","","694"
"800","Boné Infantil Baby Proteção UV Azul","201001813801","Boné","Normal","Não","Não Postado","","","","","695"
"801","Boné Infantil Baby Proteção UV Rosa","201001802701","Boné","Normal","Não","Não Postado","","","","","696"
"806","Boné Infantil com Proteção de Nuca e UV","203001519005","Boné","Normal","Não","Não Postado","","","","","697"
"802","Boné Infantil Legionário Azul - Proteção Solar UV","2.030.015","Boné","Normal","Não","Não Postado","","","","","698"
"803","Boné Infantil Legionário Rosa - Proteção Solar UV","2030015","Boné","Normal","Não","Não Postado","","","","","699"
"804","Boné Infantil McQueen - Proteção Solar Uv","2010036","Boné","Normal","Não","Não Postado","","","","","700"
"807","Boné Legionário Atacama Gelo","BN002","Boné","Normal","Não","Não Postado","","","","","701"
"808","Boné Legionário Atacama-Gelo-Tamanho Único","BN002-Gelo-Tamanho Único","Boné","Normal","Não","Não Postado","","","","","702"
"809","Boné Legionário Atacama-Ocre-Tamanho Único","BN002+4-Ocre-Tamanho Único","Boné","Normal","Não","Não Postado","","","","","703"
"810","Boné Legionário Bebê Basic Kids Verde Água com Proteção Solar","2030015190","Boné","Normal","Não","Não Postado","","","","","704"
"812","Boné Legionário Camaleão-Branco-Tamanho de 4 a 6 anos","5360006008-Branco-4 a 6 anos","Boné","Normal","Não","Não Postado","","","","","705"
"815","Boné Legionário Chicken-Vermelho-Tamanho de 4 a 6 anos","5150206009-Vermelho-4 a 6 anos","Boné","Normal","Não","Não Postado","","","","","706"
"816","Boné Legionário Infantil com Proteção Solar UV.LINE Azul","2030089","Boné","Normal","Não","Não Postado","","","","","707"
"823","Boné Masculino Bari Azul Claro Leve","075.00.06.090","Boné","Normal","Não","Não Postado","","","","","708"
"824","Boné Masculino Bari Azul Marinho Leve","075.00.06.024","Boné","Normal","Não","Não Postado","","","","","709"
"825","Boné Masculino Bari Azul Marinho Poá Colorido","075.00.06.153","Boné","Normal","Não","Não Postado","","","","","710"
"826","Boné Masculino Bari Branco Leve","075.00.06.023","Boné","Normal","Não","Não Postado","","","","","711"
"827","Boné Masculino Bari Camuflado","075.00.06.039","Boné","Normal","Não","Não Postado","","","","","712"
"830","Boné Masculino Bari Cáqui Leve","075.00.06.057","Boné","Normal","Não","Não Postado","","","","","713"
"828","Boné Masculino Bari Cinza Claro Leve","075.00.06.046","Boné","Normal","Não","Não Postado","","","","","714"
"829","Boné Masculino Bari Cinza Escuro Leve","075.00.06.054","Boné","Normal","Não","Não Postado","","","","","715"
"831","Boné Masculino Bari Jeans Leve","075.00.06.044","Boné","Normal","Não","Não Postado","","","","","716"
"832","Boné Masculino Bari Listrado Bege","075.00.06.099","Boné","Normal","Não","Não Postado","","","","","717"
"833","Boné Masculino Bari Marfim Leve","075.00.06.027","Boné","Normal","Não","Não Postado","","","","","718"
"834","Boné Masculino Bari Marrom Leve","075.00.06.053","Boné","Normal","Não","Não Postado","","","","","719"
"835","Boné Masculino Bari Preto Leve","075.00.06.022","Boné","Normal","Não","Não Postado","","","","","720"
"837","Boné Masculino Bari Rosa com Alto Relevo","075.00.06.141","Boné","Normal","Não","Não Postado","","","","","721"
"836","Boné Masculino Bari Rosa Leve","075.00.06.040","Boné","Normal","Não","Não Postado","","","","","722"
"838","Boné Masculino Bari Veludo Azul Marinho","075.00.06.724","Boné","Normal","Não","Não Postado","","","","","723"
"839","Boné Masculino Bari Veludo Bordô","075.00.06.745","Boné","Normal","Não","Não Postado","","","","","724"
"840","Boné Masculino Bari Veludo Cinza","075.00.06.746","Boné","Normal","Não","Não Postado","","","","","725"
"841","Boné Masculino Bari Veludo Marrom","075.00.06.747","Boné","Normal","Não","Não Postado","","","","","726"
"842","Boné Masculino Bari Veludo Preto","075.00.06.722","Boné","Normal","Não","Não Postado","","","","","727"
"843","Boné Masculino Bari Veludo Verde","075.00.06.725","Boné","Normal","Não","Não Postado","","","","","728"
"844","Boné Masculino Bari Verde Militar Leve","075.00.06.091","Boné","Normal","Não","Não Postado","","","","","729"
"845","Boné Masculino Bari Verde Poá Colorido","075.00.06.154","Boné","Normal","Não","Não Postado","","","","","730"
"846","Boné Masculino Bari Vermelho Leve","075.00.06.026","Boné","Normal","Não","Não Postado","","","","","731"
"847","Boné Masculino Bari Vinho Poá Colorido","075.00.06.155","Boné","Normal","Não","Não Postado","","","","","732"
"848","Boné Masculino Bari Xadrez Bege, Marrom, Laranja, Amarelo e Verde","075.00.06.116","Boné","Normal","Não","Não Postado","","","","","733"
"849","Boné Masculino Bari Xadrez Branco, Preto e Vinho","075.00.06.185","Boné","Normal","Não","Não Postado","","","","","734"
"852","Boné Masculino Bari Xadrez Cáqui e Bege","075.00.06.092","Boné","Normal","Não","Não Postado","","","","","735"
"850","Boné Masculino Bari Xadrez Cinza, Branco e Azul","075.00.06.109","Boné","Normal","Não","Não Postado","","","","","736"
"851","Boné Masculino Bari Xadrez Cinza, Lilás, Preto e Branco","075.00.06.146","Boné","Normal","Não","Não Postado","","","","","737"
"853","Boné Masculino Bari Xadrez Marrom e Bege","075.00.06.113","Boné","Normal","Não","Não Postado","","","","","738"
"854","Boné Masculino Bari Xadrez Marrom, Bege e Laranja","075.00.06.147","Boné","Normal","Não","Não Postado","","","","","739"
"855","Boné Masculino Bari Xadrez Médio Preto e Branco","075.00.06.143","Boné","Normal","Não","Não Postado","","","","","740"
"856","Boné Masculino Bari Xadrez Preto, Bege e Grafite","075.00.06.144","Boné","Normal","Não","Não Postado","","","","","741"
"857","Boné Masculino Bari Xadrez Preto, Bege, Marrom e Verde","075.00.06.120","Boné","Normal","Não","Não Postado","","","","","742"
"858","Boné Masculino Bari Xadrez Rosa, Marfim e Bege","075.00.06.145","Boné","Normal","Não","Não Postado","","","","","743"
"859","Boné Masculino Bari Zig-Zag Bege e Cáqui","075.00.06.142","Boné","Normal","Não","Não Postado","","","","","744"
"878","Boné Masculino UVLine Proteção Solar UV Saara Preto","02.01.21002","Boné","Normal","Não","Não Postado","","","","","745"
"882","Boné Napa Flex Marrom","1522","Boné","Normal","Não","Não Postado","","","","","746"
"884","Boné New Fit Gelo","2010016011","Boné","Normal","Não","Não Postado","","","","","747"
"885","Boné New Fit-Azul-Tamanho Único","BN081+61-Azul-Tamanho Único","Boné","Normal","Não","Não Postado","","","","","748"
"886","Boné New Fit-Gelo-Tamanho Único","02010016011-Gelo-Tamanho Único","Boné","Normal","Não","Não Postado","","","","","749"
"888","Boné Pesca Mosquiteiro-Camuflado-Tamanho Único","19204-Camuflado-Tamanho Único","Boné","Normal","Não","Não Postado","","","","","750"
"890","Boné Pesca Mosquiteiro-Cáqui-Tamanho Único","19204-Cáqui-Tamanho Único","Boné","Normal","Não","Não Postado","","","","","751"
"889","Boné Pesca Mosquiteiro-Creme-Tamanho Único","19204-Creme-Tamanho Único","Boné","Normal","Não","Não Postado","","","","","752"
"891","Boné Pescador II San Doná Camuflado","132.00.06.039","Boné","Normal","Não","Não Postado","","","","","753"
"892","Boné Proteção Solar UV  Preto","BN008","Boné","Normal","Não","Não Postado","","","","","754"
"895","Boné Proteção Solar UV New Fit Gelo","201001635601","Boné","Normal","Não","Não Postado","","","","","755"
"896","Boné Proteção Solar UV New Fit Marinho","201001627401","Boné","Normal","Não","Não Postado","","","","","756"
"897","Boné Proteção Solar UV New Fit Preto","201001616701","Boné","Normal","Não","Não Postado","","","","","757"
"898","Boné Proteção Solar UV New Fit Verde","201001643301","Boné","Normal","Não","Não Postado","","","","","758"
"900","Boné Quepe Aba Curva Camuflado Sniper US","1605398","Boné","Normal","Não","Não Postado","","","","","759"
"901","Boné Sarja Cáqui-Cáqui-Tamanho Único","19410-caqui-Cáqui-Único","Boné","Normal","Não","Não Postado","","","","","760"
"902","Boné Sarja-Areia-Tamanho Único","19410-Areia-Tamanho Único","Boné","Normal","Não","Não Postado","","","","","761"
"903","Boné Sarja-Preto-Tamanho Único","19410-Preto-Tamanho Único","Boné","Normal","Não","Não Postado","","","","","762"
"904","Boné Sarja-Verde Musgo-Tamanho Único","19410-Verde Musgo-Único","Boné","Normal","Não","Não Postado","","","","","763"
"906","Boné Tech Flex Masculino-Preto","4680003006-Preto","Boné","Normal","Não","Não Postado","","","","","764"
"907","Boné Tecno Cool -Azul Marinho-Tamanho Único","0201000401901-Marinho-Único","Boné","Normal","Não","Não Postado","","","","","765"
"908","Boné Tecno Cool -Cinza-Tamanho Único","0201000401801-U-Cinza-Único","Boné","Normal","Não","Não Postado","","","","","766"
"909","Boné Tecno Cool-Azul Royal-Tamanho Único","BN026+171-Azul Royal-Único","Boné","Normal","Não","Não Postado","","","","","767"
"910","Boné Tecno Cool-Azul-Tamanho Único","BN026+25-Azul-Tamanho Único","Boné","Normal","Não","Não Postado","","","","","768"
"911","Boné Tecno Cool-Laranja-Tamanho Único","BN026+60-Laranja-Tamanho Único","Boné","Normal","Não","Não Postado","","","","","769"
"914","Boné Tradicional Feltro Azul Marinho San Doná","039.63.04.024","Boné","Normal","Não","Não Postado","","","","","770"
"915","Boné Tradicional Feltro Bege San Doná","039.63.04.027","Boné","Normal","Não","Não Postado","","","","","771"
"916","Boné Tradicional Feltro Cinza San Doná","039.63.04.046","Boné","Normal","Não","Não Postado","","","","","772"
"917","Boné Tradicional Feltro Marrom San Doná","039.63.04.053","Boné","Normal","Não","Não Postado","","","","","773"
"919","Boné Tradicional Feltro Verde San Doná","039.63.04.025","Boné","Normal","Não","Não Postado","","","","","774"
